[
  {
    "corpus_id": "corpus_0cc11bdfce7d1ea1",
    "source": "JW Bible - Psalm 103:12",
    "ref": "",
    "sesotho_text": "Joalokaha bochaba-tsatsi bo le hōle le bophirima-tsatsi, Ka ho tšoanang o suthiselitse litlōlo tsa rōna hōle le rōna.",
    "english_text": "As far as the sunrise is from the sunset, so far has he put our transgressions far away from us."
  },
  {
    "corpus_id": "corpus_e79b9d93ad87da5c",
    "source": "JW Bible - Romans 13:7",
    "ref": "",
    "sesotho_text": "...ea batlang tlhompho, le mo fe tlhompho e joalo.",
    "english_text": "...to the one who calls for honor, such honor."
  },
  {
    "corpus_id": "corpus_9e414345eb2b90ca",
    "source": "JW Bible - Romans 13:7",
    "ref": "",
    "sesotho_text": "...ea batlang tšabo, le mo fe tšabo e joalo.",
    "english_text": "...to the one who calls for fear, such fear."
  },
  {
    "corpus_id": "corpus_af9c9645c5999e16",
    "source": "JW Bible - Genesis 1",
    "ref": "v1001008",
    "sesotho_text": "Molimo a bitsa sepakapaka Leholimo. Ea e-ba mantsiboea ’me ea e-ba hoseng, letsatsi la bobeli.",
    "english_text": "God called the expanse Heaven. And there was evening and there was morning, a second day."
  },
  {
    "corpus_id": "corpus_ce64ade4ce712f36",
    "source": "JW Bible - Genesis 1",
    "ref": "v1001001",
    "sesotho_text": "Tšimolohong Molimo o ile a bōpa maholimo le lefatše.",
    "english_text": "In the beginning God created the heavens and the earth."
  },
  {
    "corpus_id": "corpus_49b0365fb4a1f9d8",
    "source": "JW Bible - Genesis 1",
    "ref": "v1001002",
    "sesotho_text": "Joale lefatše le ne le se na sebōpeho ebile le se na letho ’me lefifi le ne le le holim ’a boliba; matla a sebetsang a Molimo a ne a e-ea koana le koana holim ’a metsi.",
    "english_text": "Now the earth was formless and desolate, and there was darkness upon the surface of the watery deep, and God’s active force was moving about over the surface of the waters."
  },
  {
    "corpus_id": "corpus_dcdb01a84d1ab2ca",
    "source": "JW Bible - Genesis 1",
    "ref": "v1001003",
    "sesotho_text": "Molimo a re: “Leseli le ke le be teng.” Joale leseli la e-ba teng.",
    "english_text": "And God said: “Let there be light.” Then there was light."
  },
  {
    "corpus_id": "corpus_d1f50f92d89623d3",
    "source": "JW Bible - Genesis 1",
    "ref": "v1001005",
    "sesotho_text": "Molimo a bitsa leseli Motšehare, empa lefifi a le bitsa Bosiu. Ea e-ba mantsiboea ’me ea e-ba hoseng, letsatsi la pele.",
    "english_text": "God called the light Day, but the darkness he called Night. And there was evening and there was morning, a first day."
  },
  {
    "corpus_id": "corpus_e27b8b1add2f5139",
    "source": "JW Bible - Genesis 1",
    "ref": "v1001006",
    "sesotho_text": "Molimo a tsoela pele ho re: “Ho ke ho be le sepakapaka pakeng tsa metsi ’me ho ke ho be le karohano pakeng tsa metsi le metsi.”",
    "english_text": "Then God said: “Let there be an expanse between the waters, and let there be a division between the waters and the waters.”"
  },
  {
    "corpus_id": "corpus_e676a9bef91e986a",
    "source": "JW Bible - Genesis 1",
    "ref": "v1001009",
    "sesotho_text": "Molimo a tsoela pele ho re: “Metsi a ka tlas’a maholimo a ke a bokelloe sebakeng se le seng ’me ho ke ho hlahe naha e omileng.” ’Me ha e-ba joalo.",
    "english_text": "Then God said: “Let the waters under the heavens be collected together into one place, and let the dry land appear.” And it was so."
  },
  {
    "corpus_id": "corpus_c0f62ecb0100a01c",
    "source": "JW Bible - Genesis 1",
    "ref": "v1001021",
    "sesotho_text": "Eaba Molimo o bōpa liphoofolo tsa litonanahali tsa leoatle le moea o mong le o mong o phelang o tsamaeang, tseo metsi a li hlahisitseng ka bongata ho ea ka mefuta ea tsona, le sebōpuoa se seng le se seng se fofang se nang le mapheo ho ea ka mofuta oa sona. ’Me Molimo a bona hore ho molemo.",
    "english_text": "And God created the great sea creatures and all living creatures that move and swarm in the waters according to their kinds and every winged flying creature according to its kind. And God saw that it was good."
  },
  {
    "corpus_id": "corpus_ac95141977fd61ab",
    "source": "JW Bible - Genesis 1",
    "ref": "v1001011",
    "sesotho_text": "Molimo a tsoela pele ho re: “Lefatše le ke le hlahise joang, limela tse behang peō, lifate tsa litholoana tse behang litholoana ho ea ka mefuta ea tsona, tseo peō ea tsona e leng ho tsona, holim ’a lefatše.” ’Me ha e-ba joalo.",
    "english_text": "Then God said: “Let the earth cause grass to sprout, seed-bearing plants and fruit trees according to their kinds, yielding fruit along with seed on the earth.” And it was so."
  },
  {
    "corpus_id": "corpus_4311853eaae47d37",
    "source": "JW Bible - Genesis 1",
    "ref": "v1001014",
    "sesotho_text": "Ho ke ho be le mehloli ea leseli sepakapakeng sa maholimo.",
    "english_text": "Let there be lights in the firmament of the heavens."
  },
  {
    "corpus_id": "corpus_a11b67da6f08aff7",
    "source": "JW Bible - Genesis 1",
    "ref": "v1001014",
    "sesotho_text": "Molimo a tsoela pele ho re: “Ho ke ho be le mehloli ea leseli sepakapakeng sa maholimo ho etsa karohano pakeng tsa motšehare le bosiu; ’me e tla ba lipontšo le linako tsa selemo le matsatsi le lilemo.",
    "english_text": "Then God said: “Let there be luminaries in the expanse of the heavens to make a division between the day and the night, and they will serve as signs for seasons and for days and years."
  },
  {
    "corpus_id": "corpus_cee096e7744ea1c9",
    "source": "JW Bible - Genesis 1",
    "ref": "v1001016",
    "sesotho_text": "Molimo a etsa mehloli e ’meli e meholo ea leseli, mohloli o moholo oa leseli bakeng sa ho laola motšehare le mohloli o monyenyane oa leseli bakeng sa ho laola bosiu, le linaleli.",
    "english_text": "And God went on to make the two great luminaries, the greater luminary for dominating the day and the lesser luminary for dominating the night, and also the stars."
  },
  {
    "corpus_id": "corpus_f0a2c589897ab62a",
    "source": "JW Bible - Genesis 1",
    "ref": "v1001020",
    "sesotho_text": "Libōpuoa tse fofang li ke li fofe holim 'a lefatše.",
    "english_text": "Let birds fly above the earth."
  },
  {
    "corpus_id": "corpus_a20cc4c30f386b4d",
    "source": "JW Bible - Genesis 1",
    "ref": "v1001024",
    "sesotho_text": "Molimo a tsoela pele ho re: “Lefatše le ke le hlahise meea e phelang ho ea ka mefuta ea eona, phoofolo e ruuoang le phoofolo e hahabang le sebata sa lefatše ho ea ka mofuta oa sona.” ’Me ha e-ba joalo.",
    "english_text": "Then God said: “Let the earth bring forth living creatures according to their kinds, domestic animals and creeping animals and wild animals of the earth according to their kinds.” And it was so."
  },
  {
    "corpus_id": "corpus_4933a5acac4926a3",
    "source": "JW Bible - Genesis 1",
    "ref": "v1001026",
    "sesotho_text": "Molimo a tsoela pele ho re: “A re etse motho ka setšoantšo sa rōna, ho ea ka sebōpeho sa rōna, ’me ba laole litlhapi tsa leoatle le libōpuoa tse fofang tsa maholimo le liphoofolo tse ruuoang le lefatše lohle le phoofolo e ’ngoe le e ’ngoe e hahabang lefatšeng.”",
    "english_text": "Then God said: “Let us make man in our image, according to our likeness, and let them have in subjection the fish of the sea and the flying creatures of the heavens and the domestic animals and all the earth and every creeping animal that is moving on the earth.”"
  },
  {
    "corpus_id": "corpus_6bf6a54687b0a470",
    "source": "JW Bible - Genesis 1",
    "ref": "v1001027",
    "sesotho_text": "Molimo a bōpa motho ka setšoantšo sa hae, a mo bōpa ka setšoantšo sa Molimo; a ba bōpa e le e motona le e motšehali.",
    "english_text": "And God went on to create the man in his image, in God’s image he created him; male and female he created them."
  },
  {
    "corpus_id": "corpus_9463cc76e385ddf1",
    "source": "JW Bible - Genesis 1",
    "ref": "v1001004",
    "sesotho_text": "Ka mor’a moo Molimo a bona hore leseli le molemo, ’me Molimo a hlahisa karohano pakeng tsa leseli le lefifi.",
    "english_text": "After that God saw that the light was good, and God began to divide the light from the darkness."
  },
  {
    "corpus_id": "corpus_5c3e5ad78c4739f9",
    "source": "JW Bible - Ps103",
    "ref": "v19103016",
    "sesotho_text": "Empa ha moea o foka, ea nyamelaJoalokaha eka ha e e-s'o ka e e-ba teng.",
    "english_text": "But when a wind blows, it is no more,As though it was never there."
  },
  {
    "corpus_id": "corpus_872a49f0943bc930",
    "source": "JW Bible - Gen1",
    "ref": "v1001004",
    "sesotho_text": "Ka mor'a moo Molimo a bona hore leseli le molemo, 'me Molimo a hlahisa karohano pakeng tsa leseli le lefifi.",
    "english_text": "After that God saw that the light was good, and God began to divide the light from the darkness."
  },
  {
    "corpus_id": "corpus_211d88bf85728b58",
    "source": "JW Bible - Ps103",
    "ref": "v19103012",
    "sesotho_text": "Feela joalokaha bochabela bo le hole le bophirimela,Ka ho tšoanang o suthiselitse liphoso tsa rona hole le rona.",
    "english_text": "As far off as the sunrise is from the sunset,So far off from us he has put our transgressions."
  },
  {
    "corpus_id": "corpus_f10fcc078bb6f41e",
    "source": "JW Bible - Gen2",
    "ref": "v1002003",
    "sesotho_text": "Molimo a hlohonolofatsa letsatsi la bosupa 'me a re lea halalela hobane letsatsing leo o ile a phomola ka mor'a mosebetsi oohle oo a o entseng.",
    "english_text": "And God went on to bless the seventh day and to declare it sacred, for on it God has been resting from all the work that he has created, all that he purposed to make."
  },
  {
    "corpus_id": "corpus_0868a8eccd17c1d0",
    "source": "JW Bible - Ps103",
    "ref": "v19103008",
    "sesotho_text": "Jehova o mohau 'me o na le kutloelo-bohloko,O lieha ho halefa ebile o lerato.",